A2: Timing of float functions in [ns]
B4: RP2040-B2 | C4: RP2040-B2 | D4: RP2350-A2 | E4: RP2350-A2 | F4: RP2350-A2 | G4: RP2350-A2 | H4: RP2350-A2
A5: function | B5: @125MHz | C5: @125MHz | D5: @150MHz | E5: @150MHz | F5: @150MHz | G5: @150MHz | H5: @150MHz
B6: libc | C6: fast | D6: ARM libc | E6: ARM DCP | F6: ARM DCP+VFP | G6: RISC-V libc | H6: RISC-V fast
A7: copysignf | B7: 40 | C7: 40 | D7: 6 | E7: 6 | F7: 6 | G7: 33 | H7: 41
A8: isintf | B8: 84 | C8: 84 | D8: 42 | E8: 42 | F8: 42 | G8: 51 | H8: 51
A9: isoddintf | B9: 58 | C9: 59 | D9: 34 | E9: 34 | F9: 34 | G9: 52 | H9: 52
A10: ispow2f | B10: 87 | C10: 88 | D10: 53 | E10: 53 | F10: 53 | G10: 33 | H10: 33
A11: ldexpf | B11: 1710 | C11: 125 | D11: 1280 | E11: 64 | F11: 64 | G11: 893 | H11: 85
A12: fadd | B12: 897 | C12: 577 | D12: 253 | E12: 53 | F12: 53 | G12: 552 | H12: 179
A13: fsub | B13: 988 | C13: 601 | D13: 265 | E13: 53 | F13: 53 | G13: 560 | H13: 182
A14: fmul | B14: 1290 | C14: 469 | D14: 291 | E14: 73 | F14: 73 | G14: 786 | H14: 212
A15: fsqr | B15: 1290 | C15: 479 | D15: 313 | E15: 27 | F15: 27 | G15: 795 | H15: 268
A16: fdiv | B16: 3590 | C16: 708 | D16: 867 | E16: 133 | F16: 133 | G16: 1280 | H16: 463
A17: frec | B17: 3680 | C17: 726 | D17: 896 | E17: 127 | F17: 127 | G17: 1320 | H17: 538
A18: fmodf | B18: 1030 | C18: 320 | D18: 695 | E18: 143 | F18: 143 | G18: 543 | H18: 164
A19: remquof | B19: 3200 | C19: 496 | D19: 1730 | E19: 244 | F19: 244 | G19: 1710 | H19: 230
A20: remainderf | B20: 4100 | C20: 624 | D20: 2040 | E20: 278 | F20: 278 | G20: 2470 | H20: 258
A21: fcmp | B21: 1110 | C21: 180 | D21: 893 | E21: 73 | F21: 73 | G21: 442 | H21: 441
A22: fcmpeq | B22: 495 | C22: 310 | D22: 433 | E22: 53 | F22: 53 | G22: 174 | H22: 173
A23: fcmplt | B23: 570 | C23: 310 | D23: 440 | E23: 60 | F23: 60 | G23: 209 | H23: 208
A24: fcmple | B24: 571 | C24: 314 | D24: 433 | E24: 60 | F24: 60 | G24: 209 | H24: 208
A25: fcmpge | B25: 570 | C25: 354 | D25: 466 | E25: 60 | F25: 60 | G25: 205 | H25: 204
A26: fcmpgt | B26: 571 | C26: 350 | D26: 460 | E26: 60 | F26: 60 | G26: 198 | H26: 198
A27: fcmpun | B27: 127 | C27: 64 | D27: 60 | E27: 53 | F27: 53 | G27: 40 | H27: 40
A28: int2float | B28: 846 | C28: 346 | D28: 260 | E28: 54 | F28: 54 | G28: 546 | H28: 128
A29: uint2float | B29: 793 | C29: 329 | D29: 254 | E29: 54 | F29: 54 | G29: 469 | H29: 108
A30: int642float | B30: 6420 | C30: 479 | D30: 277 | E30: 144 | F30: 144 | G30: 641 | H30: 258
A31: uint642float | B31: 6200 | C31: 442 | D31: 267 | E31: 114 | F31: 114 | G31: 559 | H31: 250
A32: fix2float | B32: 2540 | C32: 456 | D32: 1550 | E32: 121 | F32: 121 | G32: 1390 | H32: 223
A33: ufix2float | B33: 2480 | C33: 443 | D33: 1550 | E33: 94 | F33: 94 | G33: 1310 | H33: 226
A34: fix642float | B34: 8110 | C34: 448 | D34: 1570 | E34: 137 | F34: 137 | G34: 1490 | H34: 251
A35: ufix642float | B35: 7890 | C35: 417 | D35: 1560 | E35: 106 | F35: 106 | G35: 1410 | H35: 250
A36: float2int_z | B36: 251 | C36: 77 | D36: 164 | E36: 54 | F36: 54 | G36: 143 | H36: 53
A37: float2int | B37: 1340 | C37: 346 | D37: 709 | E37: 40 | F37: 40 | G37: 783 | H37: 196
A38: float2uint | B38: 10800 | C38: 310 | D38: 2020 | E38: 54 | F38: 54 | G38: 200 | H38: 166
A39: float2int64_z | B39: 7130 | C39: 421 | D39: 1440 | E39: 110 | F39: 110 | G39: 179 | H39: 283
A40: float2int64 | B40: 7860 | C40: 378 | D40: 2000 | E40: 174 | F40: 174 | G40: 857 | H40: 255
A41: float2uint64 | B41: 5840 | C41: 163 | D41: 1240 | E41: 87 | F41: 87 | G41: 319 | H41: 117
A42: float2fix | B42: 3360 | C42: 339 | D42: 2120 | E42: 190 | F42: 190 | G42: 1850 | H42: 190
A43: float2ufix | B43: 12300 | C43: 303 | D43: 3410 | E43: 236 | F43: 236 | G43: 1220 | H43: 160
A44: float2fix64 | B44: 9390 | C44: 368 | D44: 3300 | E44: 314 | F44: 314 | G44: 1880 | H44: 248
A45: float2ufix64 | B45: 7810 | C45: 151 | D45: 2670 | E45: 81 | F45: 81 | G45: 1330 | H45: 113
A46: truncf | B46: 139 | C46: 74 | D46: 89 | E46: 40 | F46: 40 | G46: 77 | H46: 54
A47: roundf | B47: 148 | C47: 86 | D47: 110 | E47: 52 | F47: 52 | G47: 79 | H47: 70
A48: floorf | B48: 940 | C48: 110 | D48: 470 | E48: 69 | F48: 69 | G48: 578 | H48: 70
A49: ceilf | B49: 955 | C49: 113 | D49: 478 | E49: 69 | F49: 69 | G49: 575 | H49: 74
A50: sqrtf | B50: 5840 | C50: 515 | D50: 3460 | E50: 214 | F50: 214 | G50: 3570 | H50: 355
A51: deg2radf | B51: 1320 | C51: 650 | D51: 304 | E51: 34 | F51: 34 | G51: 808 | H51: 295
A52: rad2degf | B52: 1320 | C52: 657 | D52: 301 | E52: 34 | F52: 34 | G52: 820 | H52: 305
A53: sinf | B53: 20300 | C53: 4700 | D53: 6690 | E53: 664 | F53: 381 | G53: 13200 | H53: 735
A54: sinf_deg | B54: 21900 | C54: 5300 | D54: 7100 | E54: 707 | F54: 436 | G54: 14100 | H54: 681
A55: cosf | B55: 22500 | C55: 4780 | D55: 7250 | E55: 648 | F55: 372 | G55: 14500 | H55: 766
A56: cosf_deg | B56: 23600 | C56: 5380 | D56: 7520 | E56: 687 | F56: 413 | G56: 15200 | H56: 703
A57: sincosf | B57: 42800 | C57: 4770 | D57: 14000 | E57: 936 | F57: 575 | G57: 27700 | H57: 1120
A58: sincosf_deg | B58: 44200 | C58: 5450 | D58: 14500 | E58: 989 | F58: 621 | G58: 28500 | H58: 1060
A59: tanf | B59: 40200 | C59: 5420 | D59: 13100 | E59: 1080 | F59: 628 | G59: 26200 | H59: 1610
A60: tanf_deg | B60: 41100 | C60: 6020 | D60: 13400 | E60: 1120 | F60: 674 | G60: 26800 | H60: 1560
A61: cotanf | B61: 44700 | C61: 6290 | D61: 14500 | E61: 1280 | F61: 818 | G61: 28000 | H61: 1600
A62: cotanf_deg | B62: 46000 | C62: 6900 | D62: 14900 | E62: 1320 | F62: 866 | G62: 28800 | H62: 1550
A63: asinf | B63: 30600 | C63: 7960 | D63: 10200 | E63: 1160 | F63: 764 | G63: 18800 | H63: 558
A64: asinf_deg | B64: 32300 | C64: 8590 | D64: 10600 | E64: 1260 | F64: 863 | G64: 19800 | H64: 566
A65: acosf | B65: 31200 | C65: 7830 | D65: 10600 | E65: 1150 | F65: 739 | G65: 19200 | H65: 595
A66: acosf_deg | B66: 32500 | C66: 8470 | D66: 10800 | E66: 1250 | F66: 839 | G66: 19900 | H66: 606
A67: atanf | B67: 29600 | C67: 5390 | D67: 8840 | E67: 919 | F67: 524 | G67: 18800 | H67: 979
A68: atanf_deg | B68: 30900 | C68: 6040 | D68: 9110 | E68: 1020 | F68: 624 | G68: 19600 | H68: 1030
A69: acotanf | B69: 30500 | C69: 6360 | D69: 9290 | E69: 1070 | F69: 686 | G69: 19200 | H69: 1040
A70: acotanf_deg | B70: 32200 | C70: 7060 | D70: 9740 | E70: 1190 | F70: 791 | G70: 20400 | H70: 1070
A71: atan2f | B71: 10100 | C71: 3450 | D71: 3030 | E71: 589 | F71: 473 | G71: 5760 | H71: 1070
A72: atanf2_deg | B72: 11700 | C72: 4280 | D72: 3410 | E72: 695 | F72: 573 | G72: 6720 | H72: 1400
A73: sinhf | B73: 36200 | C73: 4700 | D73: 11100 | E73: 527 | F73: 396 | G73: 21600 | H73: 735
A74: coshf | B74: 33400 | C74: 9460 | D74: 11700 | E74: 1090 | F74: 787 | G74: 19900 | H74: 1430
A75: tanhf | B75: 35300 | C75: 3140 | D75: 10600 | E75: 363 | F75: 300 | G75: 20800 | H75: 890
A76: asinhf | B76: 39300 | C76: 4330 | D76: 12900 | E76: 363 | F76: 300 | G76: 23700 | H76: 1150
A77: acoshf | B77: 44900 | C77: 10000 | D77: 16100 | E77: 710 | F77: 590 | G77: 27000 | H77: 2660
A78: atanhf | B78: 38100 | C78: 2800 | D78: 11700 | E78: 243 | F78: 193 | G78: 22900 | H78: 708
A79: expf | B79: 23600 | C79: 4240 | D79: 8110 | E79: 313 | F79: 281 | G79: 14000 | H79: 476
A80: logf | B80: 23500 | C80: 6220 | D80: 7860 | E80: 443 | F80: 307 | G80: 14500 | H80: 633
A81: exp2f | B81: 79300 | C81: 4860 | D81: 23200 | E81: 351 | F81: 326 | G81: 47600 | H81: 431
A82: log2f | B82: 26700 | C82: 6860 | D82: 8920 | E82: 544 | F82: 407 | G82: 15600 | H82: 680
A83: exp10f | B83: 97800 | C83: 4860 | D83: 34500 | E83: 352 | F83: 328 | G83: 61700 | H83: 529
A84: log10f | B84: 26900 | C84: 6860 | D84: 8940 | E84: 543 | F84: 407 | G84: 16900 | H84: 687
A85: expm1f | B85: 28100 | C85: 3450 | D85: 8330 | E85: 312 | F85: 279 | G85: 17200 | H85: 599
A86: log1pf | B86: 13900 | C86: 2630 | D86: 4310 | E86: 196 | F86: 151 | G86: 8550 | H86: 388
A87: fmaf | B87: 5830 | C87: 1190 | D87: 1350 | E87: 53 | F87: 53 | G87: 3090 | H87: 475
A88: powintf | B88: 61900 | C88: 7440 | D88: 20600 | E88: 880 | F88: 808 | G88: 38200 | H88: 1590
A89: powf | B89: 48500 | C89: 10400 | D89: 16000 | E89: 1040 | F89: 978 | G89: 30000 | H89: 1750
A90: hypotf | B90: 17100 | C90: 2770 | D90: 6080 | E90: 446 | F90: 446 | G90: 8670 | H90: 1370
A91: cbrtf | B91: 17500 | C91: 11800 | D91: 5710 | E91: 1190 | F91: 1010 | G91: 8480 | H91: 1660
A92: absf | B92: 15 | C92: 16 | D92: 7 | E92: 7 | F92: 7 | G92: 7 | H92: 13
A93: float2double | B93: 87 | C93: 87 | D93: 147 | E93: 34 | F93: 34 | G93: 221 | H93: 215
A94: average: | B94: =AVERAGE(B7:B93) -> 16723.126436781607 | C94: =AVERAGE(C7:C93) -> 2807.4942528735633 | D94: =AVERAGE(D7:D93) -> 5405.3678160919544 | E94: =AVERAGE(E7:E93) -> 392.63218390804599 | F94: =AVERAGE(F7:F93) -> 292.79310344827587 | G94: =AVERAGE(G7:G93) -> 9740.6436781609191 | H94: =AVERAGE(H7:H93) -> 555.10344827586209
A95: median: | B95: =MEDIAN(B7:B93) -> 7860 | C95: =MEDIAN(C7:C93) -> 624 | D95: =MEDIAN(D7:D93) -> 2040 | E95: =MEDIAN(E7:E93) -> 190 | F95: =MEDIAN(F7:F93) -> 174 | G95: =MEDIAN(G7:G93) -> 1710 | H95: =MEDIAN(H7:H93) -> 305
A98: Timing of double functions in [ns]
B100: RP2040-B2 | C100: RP2040-B2 | D100: RP2350-A2 | E100: RP2350-A2 | F100: RP2350-A2 | G100: RP2350-A2 | H100: RP2350-A2
A101: function | B101: @125MHz | C101: @125MHz | D101: @150MHz | E101: @150MHz | F101: @150MHz | G101: @150MHz | H101: @150MHz
B102: libc | D102: ARM libc | E102: ARM DCP | F102: ARM DCP+VFP | G102: RISC-V libc | H102: RISC-V fast
A103: copysign | B103: 136 | C103: 136 | D103: 30 | E103: 30 | F103: 30 | G103: 26 | H103: 53
A104: isintd | B104: 203 | C104: 203 | D104: 55 | E104: 55 | F104: 55 | G104: 58 | H104: 51
A105: isoddintd | B105: 154 | C105: 155 | D105: 41 | E105: 41 | F105: 41 | G105: 54 | H105: 54
A106: ispow2d | B106: 110 | C106: 111 | D106: 46 | E106: 46 | F106: 46 | G106: 60 | H106: 60
A107: ldexp | B107: 2490 | C107: 263 | D107: 1400 | E107: 120 | F107: 120 | G107: 1070 | H107: 85
A108: dadd | B108: 1350 | C108: 659 | D108: 306 | E108: 60 | F108: 60 | G108: 674 | H108: 664
A109: dsub | B109: 1460 | C109: 698 | D109: 322 | E109: 60 | F109: 60 | G109: 714 | H109: 692
A110: dmul | B110: 3070 | C110: 1220 | D110: 475 | E110: 173 | F110: 173 | G110: 1420 | H110: 1410
A111: dsqr | B111: 3070 | C111: 1230 | D111: 514 | E111: 274 | F111: 274 | G111: 1420 | H111: 1410
A112: ddiv | B112: 3950 | C112: 1500 | D112: 3380 | E112: 233 | F112: 233 | G112: 2500 | H112: 2480
A113: drec | B113: 4090 | C113: 1520 | D113: 3420 | E113: 354 | F113: 354 | G113: 2590 | H113: 2590
A114: fmod | B114: 2020 | C114: 410 | D114: 922 | E114: 162 | F114: 162 | G114: 729 | H114: 172
A115: remquo | B115: 6180 | C115: 478 | D115: 1950 | E115: 241 | F115: 241 | G115: 2600 | H115: 220
A116: remainder | B116: 7900 | C116: 606 | D116: 2610 | E116: 333 | F116: 333 | G116: 3620 | H116: 243
A117: dcmp | B117: 1700 | C117: 272 | D117: 922 | E117: 399 | F117: 399 | G117: 511 | H117: 511
A118: dcmpeq | B118: 710 | C118: 390 | D118: 431 | E118: 60 | F118: 60 | G118: 173 | H118: 180
A119: dcmplt | B119: 881 | C119: 390 | D119: 425 | E119: 66 | F119: 66 | G119: 225 | H119: 222
A120: dcmple | B120: 881 | C120: 394 | D120: 431 | E120: 66 | F120: 66 | G120: 224 | H120: 222
A121: dcmpge | B121: 870 | C121: 458 | D121: 472 | E121: 66 | F121: 66 | G121: 224 | H121: 235
A122: dcmpgt | B122: 868 | C122: 455 | D122: 478 | E122: 66 | F122: 66 | G122: 217 | H122: 228
A123: dcmpun | B123: 1580 | C123: 64 | D123: 579 | E123: 60 | F123: 60 | G123: 788 | H123: 832
A124: int2double | B124: 679 | C124: 329 | D124: 347 | E124: 47 | F124: 47 | G124: 414 | H124: 314
A125: uint2double | B125: 583 | C125: 321 | D125: 327 | E125: 47 | F125: 47 | G125: 334 | H125: 247
A126: int642double | B126: 5740 | C126: 416 | D126: 451 | E126: 163 | F126: 163 | G126: 753 | H126: 663
A127: uint642double | B127: 5620 | C127: 368 | D127: 452 | E127: 134 | F127: 134 | G127: 685 | H127: 585
A128: fix2double | B128: 2850 | C128: 446 | D128: 1730 | E128: 110 | F128: 110 | G128: 1310 | H128: 440
A129: ufix2double | B129: 2750 | C129: 397 | D129: 1710 | E129: 87 | F129: 87 | G129: 1230 | H129: 374
A130: fix642double | B130: 7910 | C130: 408 | D130: 1840 | E130: 160 | F130: 160 | G130: 1650 | H130: 792
A131: ufix642double | B131: 7790 | C131: 358 | D131: 1830 | E131: 127 | F131: 127 | G131: 1580 | H131: 712
A132: double2int_z | B132: 410 | C132: 145 | D132: 153 | E132: 53 | F132: 53 | G132: 131 | H132: 137
A133: double2int | B133: 1990 | C133: 608 | D133: 784 | E133: 267 | F133: 267 | G133: 880 | H133: 281
A134: double2uint | B134: 11800 | C134: 309 | D134: 1910 | E134: 53 | F134: 53 | G134: 179 | H134: 179
A135: double2int64_z | B135: 4810 | C135: 539 | D135: 965 | E135: 134 | F135: 134 | G135: 131 | H135: 124
A136: double2int64 | B136: 6280 | C136: 513 | D136: 1640 | E136: 314 | F136: 314 | G136: 933 | H136: 318
A137: double2uint64 | B137: 6070 | C137: 207 | D137: 1140 | E137: 82 | F137: 82 | G137: 352 | H137: 348
A138: double2fix | B138: 4230 | C138: 601 | D138: 2200 | E138: 438 | F138: 438 | G138: 1810 | H138: 416
A139: double2ufix | B139: 13700 | C139: 306 | D139: 3300 | E139: 297 | F139: 297 | G139: 1110 | H139: 292
A140: double2fix64 | B140: 8280 | C140: 505 | D140: 2990 | E140: 500 | F140: 500 | G140: 1840 | H140: 440
A141: double2ufix64 | B141: 8320 | C141: 201 | D141: 2560 | E141: 83 | F141: 83 | G141: 1270 | H141: 468
A142: trunc | B142: 245 | C142: 191 | D142: 111 | E142: 52 | F142: 52 | G142: 105 | H142: 65
A143: round | B143: 278 | C143: 223 | D143: 172 | E143: 56 | F143: 56 | G143: 120 | H143: 81
A144: floor | B144: 1400 | C144: 251 | D144: 549 | E144: 69 | F144: 69 | G144: 677 | H144: 94
A145: ceil | B145: 1480 | C145: 253 | D145: 576 | E145: 71 | F145: 71 | G145: 706 | H145: 97
A146: sqrt | B146: 14700 | C146: 1310 | D146: 7800 | E146: 274 | F146: 274 | G146: 7880 | H146: 7900
A147: deg2rad | B147: 3160 | C147: 1430 | D147: 516 | E147: 280 | F147: 280 | G147: 1470 | H147: 1460
A148: rad2deg | B148: 3170 | C148: 1420 | D148: 512 | E148: 280 | F148: 280 | G148: 1480 | H148: 1470
A149: sin | B149: 40400 | C149: 13100 | D149: 9550 | E149: 1310 | F149: 1310 | G149: 19900 | H149: 19600
A150: sin_deg | B150: 44300 | C150: 14500 | D150: 10400 | E150: 1570 | F150: 1570 | G150: 21700 | H150: 21800
A151: cos | B151: 45200 | C151: 13000 | D151: 10400 | E151: 1290 | F151: 1290 | G151: 22200 | H151: 21800
A152: cos_deg | B152: 49000 | C152: 14400 | D152: 11300 | E152: 1550 | F152: 1550 | G152: 24000 | H152: 23500
A153: sincos | B153: 86500 | C153: 13900 | D153: 20400 | E153: 1800 | F153: 1800 | G153: 42700 | H153: 41900
A154: sincos_deg | B154: 90700 | C154: 15300 | D154: 21500 | E154: 2110 | F154: 2110 | G154: 44600 | H154: 43800
A155: tan | B155: 81800 | C155: 15500 | D155: 20200 | E155: 2020 | F155: 2020 | G155: 40300 | H155: 39900
A156: tan_deg | B156: 84600 | C156: 16900 | D156: 20800 | E156: 2270 | F156: 2270 | G156: 41500 | H156: 41200
A157: cotan | B157: 86900 | C157: 17300 | D157: 24500 | E157: 2410 | F157: 2410 | G157: 43400 | H157: 43000
A158: cotan_deg | B158: 91300 | C158: 18600 | D158: 25700 | E158: 2670 | F158: 2670 | G158: 45400 | H158: 45000
A159: asin | B159: 60400 | C159: 21800 | D159: 17900 | E159: 2600 | F159: 2600 | G159: 30200 | H159: 29900
A160: asin_deg | B160: 63800 | C160: 23100 | D160: 18600 | E160: 2870 | F160: 2870 | G160: 31700 | H160: 31400
A161: acos | B161: 62100 | C161: 21900 | D161: 18600 | E161: 2600 | F161: 2600 | G161: 31100 | H161: 30700
A162: acos_deg | B162: 65500 | C162: 23300 | D162: 19100 | E162: 2880 | F162: 2880 | G162: 32600 | H162: 32200
A163: atan | B163: 62700 | C163: 17300 | D163: 15600 | E163: 1750 | F163: 1750 | G163: 30900 | H163: 30700
A164: atan_deg | B164: 66800 | C164: 18800 | D164: 16500 | E164: 2050 | F164: 2050 | G164: 32800 | H164: 32500
A165: acotan | B165: 64700 | C165: 18400 | D165: 16400 | E165: 1990 | F165: 1990 | G165: 31900 | H165: 31600
A166: acotan_deg | B166: 67900 | C166: 19800 | D166: 16800 | E166: 2270 | F166: 2270 | G166: 33400 | H166: 33100
A167: atan2 | B167: 6330 | C167: 17400 | D167: 2810 | E167: 842 | F167: 842 | G167: 3320 | H167: 3260
A168: atan2_deg | B168: 10000 | C168: 18800 | D168: 3340 | E168: 1120 | F168: 1120 | G168: 5050 | H168: 4950
A169: sinh | B169: 44400 | C169: 6530 | D169: 14300 | E169: 937 | F169: 937 | G169: 22700 | H169: 18500
A170: cosh | B170: 62300 | C170: 14200 | D170: 20400 | E170: 2100 | F170: 2100 | G170: 31500 | H170: 31000
A171: tanh | B171: 65600 | C171: 4220 | D171: 20600 | E171: 724 | F171: 724 | G171: 33600 | H171: 10600
A172: asinh | B172: 49900 | C172: 5780 | D172: 18400 | E172: 958 | F172: 958 | G172: 25800 | H172: 18100
A173: acosh | B173: 87500 | C173: 12700 | D173: 32100 | E173: 2010 | F173: 2010 | G173: 45200 | H173: 41600
A174: atanh | B174: 37400 | C174: 3640 | D174: 12200 | E174: 620 | F174: 620 | G174: 19000 | H174: 10100
A175: exp | B175: 35300 | C175: 6120 | D175: 11600 | E175: 612 | F175: 612 | G175: 17600 | H175: 17300
A176: log | B176: 44200 | C176: 7170 | D176: 13100 | E176: 861 | F176: 861 | G176: 22000 | H176: 21600
A177: exp2 | B177: 138000 | C177: 10600 | D177: 38200 | E177: 1710 | F177: 1710 | G177: 69300 | H177: 16600
A178: log2 | B178: 46900 | C178: 8540 | D178: 16900 | E178: 1140 | F178: 1140 | G178: 23900 | H178: 22500
A179: exp10 | B179: 192000 | C179: 7560 | D179: 57400 | E179: 856 | F179: 856 | G179: 96200 | H179: 18500
A180: log10 | B180: 51300 | C180: 8550 | D180: 14500 | E180: 1140 | F180: 1140 | G180: 25500 | H180: 22700
A181: expm1 | B181: 56700 | C181: 4350 | D181: 15500 | E181: 582 | F181: 582 | G181: 28500 | H181: 12800
A182: log1p | B182: 17900 | C182: 2800 | D182: 5200 | E182: 397 | F182: 397 | G182: 8870 | H182: 7490
A183: fma | B183: 4190 | C183: 2040 | D183: 712 | E183: 492 | F183: 492 | G183: 2070 | H183: 2050
A184: powint | B184: 120000 | C184: 29300 | D184: 34300 | E184: 6020 | F184: 6020 | G184: 59300 | H184: 42500
A185: pow | B185: 86200 | C185: 22400 | D185: 23300 | E185: 4530 | F185: 4530 | G185: 42700 | H185: 27600
A186: hypot | B186: 3840 | C186: 5430 | D186: 1470 | E186: 1370 | F186: 1370 | G186: 2050 | H186: 2040
A187: cbrt | B187: 46200 | C187: 15300 | D187: 26200 | E187: 2310 | F187: 2310 | G187: 25900 | H187: 25700
A188: absd | B188: 951 | C188: 24 | D188: 496 | E188: 14 | F188: 14 | G188: 311 | H188: 34
A189: double2float | B189: 98 | C189: 98 | D189: 217 | E189: 40 | F189: 40 | G189: 208 | H189: 228
A190: average: | B190: =AVERAGE(B103:B189) -> 29766.977011494251 | C190: =AVERAGE(C103:C189) -> 6369.1839080459768 | D190: =AVERAGE(D103:D189) -> 8658.2643678160912 | E190: =AVERAGE(E103:E189) -> 879.74712643678163 | F190: =AVERAGE(F103:F189) -> 879.74712643678163 | G190: =AVERAGE(G103:G189) -> 14480.528735632184 | H190: =AVERAGE(H103:H189) -> 11520.264367816091
A191: median: | B191: =MEDIAN(B103:B189) -> 7790 | C191: =MEDIAN(C103:C189) -> 1310 | D191: =MEDIAN(D103:D189) -> 2560 | E191: =MEDIAN(E103:E189) -> 333 | F191: =MEDIAN(F103:F189) -> 333 | G191: =MEDIAN(G103:G189) -> 2050 | H191: =MEDIAN(H103:H189) -> 1460
C194: Medium timing of functions in [ns]
B195: RP2040-B2 | C195: RP2040-B2 | D195: RP2350-A2 | E195: RP2350-A2 | F195: RP2350-A2 | G195: RP2350-A2 | H195: RP2350-A2
B196: @125MHz | C196: @125MHz | D196: @150MHz | E196: @150MHz | F196: @150MHz | G196: @150MHz | H196: @150MHz
B197: libc | D197: ARM libc | E197: ARM DCP | F197: ARM DCP+VFP | G197: RISC-V libc | H197: RISC-V fast
A198: float | B198: =(B94+B95)/2 -> 12291.563218390804 | C198: =(C94+C95)/2 -> 1715.7471264367816 | D198: =(D94+D95)/2 -> 3722.6839080459772 | E198: =(E94+E95)/2 -> 291.31609195402302 | F198: =(F94+F95)/2 -> 233.39655172413794 | G198: =(G94+G95)/2 -> 5725.3218390804595 | H198: =(H94+H95)/2 -> 430.05172413793105
A199: double | B199: =(B190+B191)/2 -> 18778.488505747126 | C199: =(C190+C191)/2 -> 3839.5919540229884 | D199: =(D190+D191)/2 -> 5609.1321839080456 | E199: =(E190+E191)/2 -> 606.37356321839081 | F199: =(F190+F191)/2 -> 606.37356321839081 | G199: =(G190+G191)/2 -> 8265.264367816093 | H199: =(H190+H191)/2 -> 6490.1321839080456
A202: Comparison of the effect of GCC compiler optimization settings on C function compilation and comparison with ASM variant:
D203: RISC-V GCC compiler 13.2.0
B204: [ns] | C204: expf() Cheb | D204: logf() Cheb | E204: expf() Tayl | F204: logf() Merc
B205: "C" -O0 | C205: 4100 | D205: 5380 | E205: 5700 | F205: 10300
B206: "C" -O1 | C206: 524 | D206: 1150 | E206: 579 | F206: 1020
B207: "C" -Og -g3 | C207: 519 | D207: 1120 | E207: 604 | F207: 1030
B208: "C" -O2 | C208: 520 | D208: 727 | E208: 567 | F208: 1050
B209: "C" -O3 | C209: 520 | D209: 727 | E209: 567 | F209: 1050
B210: "C" -Ofast | C210: 520 | D210: 727 | E210: 560 | F210: 1060
B211: "C" -Os | C211: 513 | D211: *749* | E211: 564 | F211: 1030
B212: ASM | C212: 475 | D212: 633 | E212: 532 | F212: 822
B213: * = compiler included another non-inline function with similar code instead of inline